[
  {
    "active": true,
    "careers_url": null,
    "employee_count": 318,
    "first_seen": "2026-05-17T03:01:13.233032+00:00",
    "founded_year": 2020,
    "hq_city": "San Francisco",
    "hq_country": "United States",
    "id": "efb13587-a625-4d0c-ab1c-9c07a8a9b1c9",
    "industry": "AI & ML",
    "investors": [
      "Accel",
      "Afore Capital",
      "Andreessen Horowitz",
      "Eric Yuan",
      "Fellows Fund",
      "Hustle Fund",
      "Jeff Weiner",
      "LocalGlobe",
      "Lorimer Ventures",
      "Script Capital",
      "South Park Commons",
      "Uncork Capital"
    ],
    "last_seen": "2026-10-16T01:27:44.88557+00:00",
    "location": "San Francisco, United States",
    "logo_url": "https://cyhliaqkzkoqzfsnferi.supabase.co/storage/v1/object/public/company-logos/e5c045acdd94c348ec083454115d01a54cf800aa130062c7607554d5e7a215fc.webp",
    "name": "Gamma",
    "size": "201-500",
    "slug": "gamma",
    "stage": "Series B",
    "subvertical": "Generative AI",
    "tagline": "An AI-powered platform for creating presentations, documents, and websites through natural language.",
    "total_raised_usd": 87000000,
    "vertical": "AI & ML",
    "website": "https://gamma.app"
  },
  {
    "active": true,
    "careers_url": "https://www.linkedin.com/company/bitgo/jobs",
    "employee_count": 566,
    "first_seen": "2026-02-07T16:52:17.348544+00:00",
    "founded_year": 2013,
    "hq_city": "Palo Alto",
    "hq_country": "United States",
    "id": "efcafa2c-9648-4993-a6ac-c06815e01f11",
    "industry": "Blockchain",
    "investors": [
      "Citi Impact Fund",
      "Craft Ventures",
      "DRW Venture Capital",
      "Founders Fund",
      "Goldman Sachs",
      "Pantera Capital",
      "Redpoint Ventures",
      "Valor Equity Partners"
    ],
    "last_seen": "2026-10-16T01:27:44.88557+00:00",
    "location": "Palo Alto, United States",
    "logo_url": "https://cyhliaqkzkoqzfsnferi.supabase.co/storage/v1/object/public/company-logos/ae694c1cc952cd369324588b8c1659e55045447e09dae97c4bdf9b7dda4e2567.webp",
    "name": "BitGo",
    "size": "501-1000",
    "slug": "bitgo",
    "stage": "Public",
    "subvertical": "Digital Asset Custody & Infrastructure",
    "tagline": "BitGo provides secure digital asset custody, wallets, and financial infrastructure for institutional and retail investors.",
    "total_raised_usd": 382300000,
    "vertical": "Blockchain",
    "website": "https://www.bitgo.com/"
  },
  {
    "active": true,
    "careers_url": null,
    "employee_count": 10,
    "first_seen": "2026-07-24T17:08:22.44638+00:00",
    "founded_year": 2023,
    "hq_city": "Berlin",
    "hq_country": "Germany",
    "id": "efe68a15-f0f5-4f33-ac8e-3608f86f6128",
    "industry": "Entertainment",
    "investors": [
      "Blackstone",
      "Cherry Ventures",
      "DST",
      "GFC",
      "Global Frontier Capital",
      "No Label Ventures",
      "Speedinvest"
    ],
    "last_seen": "2026-10-16T01:27:44.88557+00:00",
    "location": "Berlin, Germany",
    "logo_url": "https://cyhliaqkzkoqzfsnferi.supabase.co/storage/v1/object/public/company-logos/892c9858ec07083c199ddca417043caf91476c40d7e3e0e1883eced24362111d.webp",
    "name": "Melotech",
    "size": "1-10",
    "slug": "melotech",
    "stage": "Seed",
    "subvertical": "Generative AI",
    "tagline": "Revolutionizing media and entertainment by creating music and video content at scale using generative AI.",
    "total_raised_usd": null,
    "vertical": "Entertainment",
    "website": "https://melotech.com/"
  },
  {
    "active": true,
    "careers_url": null,
    "employee_count": 700,
    "first_seen": "2026-06-26T01:25:12.737291+00:00",
    "founded_year": 2015,
    "hq_city": "Austin",
    "hq_country": "United States",
    "id": "f0ab61cf-1878-4f46-b8fe-f49cc19ec6c0",
    "industry": "SaaS",
    "investors": [
      "GI Partners",
      "Golub Capital",
      "Park Square Capital"
    ],
    "last_seen": "2026-10-16T01:27:44.88557+00:00",
    "location": "Austin, United States",
    "logo_url": "https://cyhliaqkzkoqzfsnferi.supabase.co/storage/v1/object/public/company-logos/5c1f4b741e559785db8035dc1b160e6f531b44f0e00a58a502d8b2942d282f39.webp",
    "name": "Togetherwork",
    "size": "501-1000",
    "slug": "togetherwork",
    "stage": "Acquired",
    "subvertical": "Group Management Software and Payments",
    "tagline": "Provides integrated software and financial solutions for member-based organizations and groups.",
    "total_raised_usd": 77500000,
    "vertical": "SaaS",
    "website": null
  },
  {
    "active": true,
    "careers_url": null,
    "employee_count": 666,
    "first_seen": "2026-07-24T17:02:23.091316+00:00",
    "founded_year": 2006,
    "hq_city": "Austin",
    "hq_country": "United States",
    "id": "f0fc8edb-66fa-419d-8d4e-592c26ea44d7",
    "industry": "Media",
    "investors": [
      "Bertelsmann Digital Media Investments",
      "Causeway Media Partners LP",
      "DCM Ventures",
      "Discovery Communications",
      "Dream Sports",
      "Fertitta Capital",
      "World Wrestling Entertainment Inc."
    ],
    "last_seen": "2026-10-16T01:27:44.88557+00:00",
    "location": "Austin, United States",
    "logo_url": "https://cyhliaqkzkoqzfsnferi.supabase.co/storage/v1/object/public/company-logos/f8544aa52a2c72489167d4a9ef277fc0fd041d962f52df91d8248584a770ba2e.webp",
    "name": "FloSports, Inc.",
    "size": "501-1000",
    "slug": "flosports-inc",
    "stage": "Series D",
    "subvertical": "Sports Streaming",
    "tagline": "A global sports media company delivering live and on-demand event coverage, original content, and comprehensive sports data solutions to passionate and underserved sports communities.",
    "total_raised_usd": 100000000,
    "vertical": "Media",
    "website": "https://flosports.io/"
  },
  {
    "active": true,
    "careers_url": "https://netdocuments.com/company/careers/",
    "employee_count": 486,
    "first_seen": "2026-02-07T16:52:56.550056+00:00",
    "founded_year": 1999,
    "hq_city": "Lehi",
    "hq_country": "United States",
    "id": "f1542c64-c13f-4062-86a7-cefb51bf9305",
    "industry": "LegalTech",
    "investors": [
      "Cove Hill Partners",
      "Warburg Pincus"
    ],
    "last_seen": "2026-10-16T01:27:44.88557+00:00",
    "location": "Lehi, United States",
    "logo_url": "https://cyhliaqkzkoqzfsnferi.supabase.co/storage/v1/object/public/company-logos/ae1a6842876740cc3c30ce6ce0f5ad0e3b88ca8eefc1efb64167202be3c62232.webp",
    "name": "NetDocuments",
    "size": "201-500",
    "slug": "netdocuments",
    "stage": "Acquired",
    "subvertical": "Legal Document Management",
    "tagline": "NetDocuments provides cloud-based document, email, and collaboration solutions for law firms, corporate legal departments, and government agencies.",
    "total_raised_usd": 30000000,
    "vertical": "LegalTech",
    "website": "https://netdocuments.com"
  },
  {
    "active": true,
    "careers_url": null,
    "employee_count": 800,
    "first_seen": "2026-07-24T22:31:46.227574+00:00",
    "founded_year": 1988,
    "hq_city": "Toronto",
    "hq_country": "Canada",
    "id": "f1df4b0a-326c-4e76-adcb-b570c0401468",
    "industry": "FinTech",
    "investors": [
      "Hg Capital"
    ],
    "last_seen": "2026-10-16T01:27:44.88557+00:00",
    "location": "Toronto, Canada",
    "logo_url": "https://cyhliaqkzkoqzfsnferi.supabase.co/storage/v1/object/public/company-logos/c20695afb682de4c94306fb01753171c78393d1bc4aa52e894c76147effdc3ef.webp",
    "name": "Caseware",
    "size": "501-1000",
    "slug": "caseware",
    "stage": "Growth",
    "subvertical": "Audit & Accounting Software",
    "tagline": "Caseware is a global AI platform for the audit and accounting profession, delivering trusted outcomes through workflow-embedded intelligence.",
    "total_raised_usd": 100000000,
    "vertical": "FinTech",
    "website": "https://www.caseware.com/"
  },
  {
    "active": true,
    "careers_url": null,
    "employee_count": 2012,
    "first_seen": "2026-07-24T22:34:54.07215+00:00",
    "founded_year": 2013,
    "hq_city": "Frankfurt",
    "hq_country": "Germany",
    "id": "f1e8b4c5-e6f4-4743-ad67-8d7c4294272a",
    "industry": "Other",
    "investors": [
      "Franz Haniel & Cie",
      "HTGF"
    ],
    "last_seen": "2026-10-16T01:27:44.88557+00:00",
    "location": "Frankfurt, Germany",
    "logo_url": "https://cyhliaqkzkoqzfsnferi.supabase.co/storage/v1/object/public/company-logos/3ff5e18ce3978ed6e40a1ba5148015b6f9fb317d34e80b3c57f8becb48e6be03.webp",
    "name": "Emma – The Sleep Company",
    "size": "1001-5000",
    "slug": "emma-the-sleep-company",
    "stage": "Acquired",
    "subvertical": "Sleep Tech",
    "tagline": "The world's leading D2C sleep brand, revolutionizing sleep through innovative products.",
    "total_raised_usd": 7030000,
    "vertical": "Other",
    "website": "https://www.emma-sleep.com/"
  },
  {
    "active": true,
    "careers_url": null,
    "employee_count": 120,
    "first_seen": "2026-08-16T03:10:44.904874+00:00",
    "founded_year": 2016,
    "hq_city": "Portland",
    "hq_country": "United States",
    "id": "f262e908-e9f8-4726-b77b-13171a630a2f",
    "industry": "CleanTech",
    "investors": [
      "Anthony Pratt",
      "Dylan Field",
      "Fortescue Ventures",
      "Founders Fund",
      "Future Positive",
      "Gigascale Capital",
      "Hanwha Asset Management (USA)",
      "Intrepid Oregon Fund",
      "John Doerr",
      "Leblon Capital",
      "Lowercarbon Capital",
      "Marc Benioff's TIME Ventures",
      "Max Levchin's SciFi Ventures",
      "Naver",
      "Nimble Partners",
      "Peter Thiel",
      "Planetary VC",
      "Portland Seed Fund",
      "Resilience Reserve",
      "Sozo Ventures",
      "Super Micro Computer",
      "Susquehanna Sustainable Investments",
      "Unless",
      "WTI",
      "WovenEarth"
    ],
    "last_seen": "2026-10-16T01:27:44.88557+00:00",
    "location": "Portland, United States",